{
  "meta": {
    "schema_version": "1.0",
    "target": "OWASP Juice Shop v20.0.0",
    "generated_at": "2026-06-13T00:00:00Z",
    "diagram_source": "derived-from-source",
    "notes": "DFD derived from: package.json, server.ts, routes/, models/, lib/insecurity.ts, ftp/ and encryptionkeys/ directory listings. No architecture diagram provided. Gaps: WebSocket event handlers (registerWebsocketEvents) and Angular frontend internal routing not fully enumerated. AI/Web3 outbound flows identified but not deeply analyzed."
  },
  "components": [
    {
      "id": "C-1",
      "name": "Angular Frontend SPA",
      "type": "process",
      "tech": "Angular 17 (TypeScript), served as static files from frontend/dist/frontend",
      "notes": "Single-page application. Communicates with backend exclusively via REST API. No server-side rendering."
    },
    {
      "id": "C-2",
      "name": "Express REST API Server",
      "type": "process",
      "tech": "Node.js 22+, Express 4.x, TypeScript, express-jwt 0.1.3, jsonwebtoken 0.4.0, Finale REST",
      "notes": "Core application process. Hosts all REST and auto-generated CRUD endpoints, serves static files, manages auth via JWT, runs Socket.IO server. Key auth logic in lib/insecurity.ts."
    },
    {
      "id": "C-3",
      "name": "SQLite Database",
      "type": "datastore",
      "tech": "SQLite 3, Sequelize ORM 6.x",
      "notes": "Stores Users (credentials, roles, TOTP secrets), Products, Baskets, Orders, Cards (payment), Feedback, Complaints, SecurityAnswers, Wallets. Some routes bypass ORM and issue raw SQL."
    },
    {
      "id": "C-4",
      "name": "MarsDB Product Reviews Store",
      "type": "datastore",
      "tech": "MarsDB 0.6.x (in-process MongoDB-compatible NoSQL)",
      "notes": "Stores product reviews. Accessed via showProductReviews, createProductReviews, updateProductReviews, likeProductReviews routes."
    },
    {
      "id": "C-5",
      "name": "Local Filesystem",
      "type": "datastore",
      "tech": "Node.js fs module, multer disk storage",
      "notes": "Contains: /ftp (acquisitions.md, incident-support.kdbx, coupons_2013.md.bak, eastere.gg, suspicious_errors.yml), /encryptionkeys (jwt.pub, premium.key), /logs (rotating access logs), /uploads/complaints (user file uploads), /frontend/dist/frontend/assets/public/images/uploads (profile images)."
    },
    {
      "id": "C-6",
      "name": "Web Browser (Unauthenticated User)",
      "type": "external_entity",
      "notes": "Internet-facing user interacting via HTTP. Not authenticated by default. All unauthenticated endpoints are reachable."
    },
    {
      "id": "C-7",
      "name": "B2B Client (External Ordering System)",
      "type": "external_entity",
      "notes": "External business client posting orders to /b2b/v2/orders. Must carry a valid JWT. Supplies orderLinesData field that is server-side eval'd."
    },
    {
      "id": "C-8",
      "name": "Prometheus Metrics Collector",
      "type": "service",
      "tech": "prom-client 15.x",
      "notes": "Collects and exposes application metrics at /metrics without any authentication or IP restriction."
    },
    {
      "id": "C-9",
      "name": "External AI Chat Service",
      "type": "external_entity",
      "tech": "@ai-sdk/openai-compatible",
      "notes": "External LLM API called via POST /rest/chat. User chat content crosses to an external provider over HTTPS."
    },
    {
      "id": "C-10",
      "name": "Ethereum Blockchain",
      "type": "external_entity",
      "tech": "ethers.js 6.x",
      "notes": "External blockchain for NFT minting and wallet verification. Outbound calls from /rest/web3/* endpoints."
    }
  ],
  "trust_boundaries": [
    {
      "id": "TB-1",
      "name": "Internet → Express Server",
      "between": ["C-6", "C-2"],
      "notes": "All HTTP traffic from untrusted internet users and B2B clients enters here. No TLS enforced at app layer (HTTP, not HTTPS, per scope manifest host config)."
    },
    {
      "id": "TB-2",
      "name": "Express Server → SQLite Database",
      "between": ["C-2", "C-3"],
      "notes": "Application-to-database boundary. Sequelize ORM is used for most queries; login.ts and search.ts issue raw SQL with direct string interpolation."
    },
    {
      "id": "TB-3",
      "name": "Express Server → Local Filesystem",
      "between": ["C-2", "C-5"],
      "notes": "Express reads FTP files and encryption keys directly from disk and serves them. Multer writes user-supplied files. Zip extraction writes to uploads/complaints with partial path-traversal protection."
    },
    {
      "id": "TB-4",
      "name": "Express Server → External Services",
      "between": ["C-2", "C-9"],
      "notes": "Outbound HTTPS connections to AI chat API and Ethereum network. User-supplied content is forwarded externally."
    }
  ],
  "data_flows": [
    {
      "id": "DF-1",
      "from": "C-6",
      "to": "C-2",
      "data": ["credentials", "PII", "financial"],
      "protocol": "HTTP",
      "crosses_boundary": true,
      "trust_boundary_id": "TB-1",
      "notes": "User submits login credentials, registration data (including role field), payment info, file uploads, and product reviews."
    },
    {
      "id": "DF-2",
      "from": "C-7",
      "to": "C-2",
      "data": ["internal", "credentials"],
      "protocol": "HTTP",
      "crosses_boundary": true,
      "trust_boundary_id": "TB-1",
      "notes": "B2B client sends JWT-authenticated order requests. orderLinesData field content is eval'd server-side via vm.runInContext."
    },
    {
      "id": "DF-3",
      "from": "C-2",
      "to": "C-3",
      "data": ["PII", "credentials", "financial", "session_tokens"],
      "protocol": "SQL",
      "crosses_boundary": true,
      "trust_boundary_id": "TB-2",
      "notes": "Express issues SQL queries to SQLite. login.ts:34 and search.ts:23 use raw string-interpolated queries enabling SQLi."
    },
    {
      "id": "DF-4",
      "from": "C-2",
      "to": "C-4",
      "data": ["public", "internal"],
      "protocol": "internal",
      "crosses_boundary": false,
      "notes": "Express queries in-process MarsDB for product reviews. NoSQL query composition paths not fully audited."
    },
    {
      "id": "DF-5",
      "from": "C-2",
      "to": "C-5",
      "data": ["confidential", "secret", "internal"],
      "protocol": "filesystem",
      "crosses_boundary": true,
      "trust_boundary_id": "TB-3",
      "notes": "Express reads/writes filesystem: serves /ftp and /encryptionkeys contents directly, writes multer uploads, reads/writes rotating access logs."
    },
    {
      "id": "DF-6",
      "from": "C-6",
      "to": "C-2",
      "data": ["internal"],
      "protocol": "HTTP",
      "crosses_boundary": true,
      "trust_boundary_id": "TB-1",
      "notes": "File uploads (XML, ZIP, YAML) from browser. XML parsed with noent:true (XXE); ZIP extracted with partial path traversal check; YAML loaded unsafely (yaml bomb risk)."
    },
    {
      "id": "DF-7",
      "from": "C-2",
      "to": "C-9",
      "data": ["internal", "PII"],
      "protocol": "HTTPS",
      "crosses_boundary": true,
      "trust_boundary_id": "TB-4",
      "notes": "User chat messages relayed to external AI service. Content may include PII depending on user input."
    }
  ],
  "crown_jewels": [
    {
      "id": "CJ-1",
      "asset": "User Credentials and Account Data",
      "why_valuable": "The Users table contains email addresses, MD5-hashed passwords (trivially crackable via rainbow tables or GPU brute-force), HMAC-SHA256'd security answers, TOTP secrets, and role assignments. Compromise enables direct account takeover for all users including admins, and enables cross-service credential stuffing since MD5 hashes facilitate password recovery.",
      "components": ["C-3"],
      "data_classification": "confidential"
    },
    {
      "id": "CJ-2",
      "asset": "JWT RSA Private Signing Key",
      "why_valuable": "The 1024-bit RSA private key is hardcoded as a plaintext string literal in lib/insecurity.ts (line 23). Any party with access to the source code can use this key to mint valid JWTs for any user identity and role (including admin) without credentials, nullifying all authentication controls.",
      "components": ["C-2"],
      "data_classification": "secret"
    },
    {
      "id": "CJ-3",
      "asset": "Payment Card and Wallet Data",
      "why_valuable": "The Cards model stores saved payment method data and the Wallet model tracks user balances. Unauthorized read access enables financial fraud; unauthorized write access enables free purchases or balance manipulation within the application.",
      "components": ["C-3"],
      "data_classification": "confidential"
    },
    {
      "id": "CJ-4",
      "asset": "FTP Sensitive Files and Encryption Keys",
      "why_valuable": "The /ftp directory contains incident-support.kdbx (KeePass password database — likely holds credentials to other systems), acquisitions.md (confidential M&A data), coupons_2013.md.bak (discount key material), and suspicious_errors.yml. The /encryptionkeys directory holds jwt.pub and premium.key. These files provide lateral movement opportunities, reveal corporate strategy, and supply additional authentication material.",
      "components": ["C-5"],
      "data_classification": "secret"
    }
  ],
  "entry_points": [
    {
      "id": "EP-1",
      "surface": "POST /rest/user/login",
      "component": "C-2",
      "authn_required": false,
      "authn_mechanism": "none",
      "exposure": "internet",
      "notes": "Accepts JSON {email, password}. Executes raw SQL SELECT with direct string interpolation (login.ts:34). No parameterized query."
    },
    {
      "id": "EP-2",
      "surface": "GET /rest/products/search?q=",
      "component": "C-2",
      "authn_required": false,
      "authn_mechanism": "none",
      "exposure": "internet",